{
  "id": "cn.tang.source.mia.stele-record",
  "kind": "museum_record",
  "title": "Mia 造像碑馆藏记录",
  "locator": {
    "label": "Minneapolis Institute of Art art/140016",
    "url": "https://collections.artsmia.org/art/140016/buddhist-votive-stele-with-buddha-and-two-bodhisattvas-china",
    "accessed_on": "2026-10-23"
  }
}
